<?xml version="1.0" encoding="utf-8"?>
<spawns xmlns:xsi="http://www.w3.org/2001/XMLSchema-instance" xsi:noNamespaceSchemaLocation="../spawns.xsd">
	<spawn_map map_id="310010000">
		<!-- Archon Legionary -->
		<spawn npc_id="205010">
			<spot x="109.0000" y="208.0000" z="213.0000" h="93" state="35"/>
			<spot x="143.0000" y="232.0000" z="199.0000" h="50" state="35"/>
			<spot x="152.0000" y="224.0000" z="213.0000" h="70" state="35"/>
			<spot x="185.0000" y="236.0000" z="223.0000" h="30" state="35"/>
			<spot x="188.1988" y="203.8012" z="219.0000" h="105" state="35"/>
		</spawn>
		<!-- Archon Legionary -->
		<spawn npc_id="205009">
			<spot x="127.0000" y="203.0000" z="225.0000" h="30" state="35"/>
			<spot x="164.0000" y="221.0000" z="220.0000" h="76" state="35"/>
			<spot x="164.0000" y="239.0000" z="220.0000" h="51" state="35"/>
			<spot x="166.0000" y="190.0000" z="203.0000" h="70" state="35"/>
			<spot x="175.0000" y="268.0000" z="212.0000" h="69" state="35"/>
		</spawn>
		<!-- Belpartan -->
		<spawn npc_id="205000">
			<spot x="85.0000" y="191.0000" z="231.6508" h="66"/>
		</spawn>
		<!-- Centurion -->
		<spawn npc_id="205011">
			<spot x="117.8750" y="214.2500" z="222.1000" h="106" state="35"/>
			<spot x="130.9070" y="204.4535" z="223.0453" h="9" state="35"/>
		</spawn>
		<!-- Centurion -->
		<spawn npc_id="205013">
			<spot x="159.3518" y="223.8024" z="218.5506" h="79" state="35"/>
			<spot x="173.2500" y="233.5000" z="226.1000" h="79" state="35"/>
		</spawn>
		<!-- Grunt -->
		<spawn npc_id="211044">
			<spot x="222.2201" y="283.6205" z="206.6727" h="101"/>
			<spot x="245.9583" y="289.8067" z="206.9398" h="98"/>
			<spot x="254.0000" y="300.0000" z="206.7753" h="30"/>
			<spot x="256.0000" y="303.0000" z="205.9827" h="60"/>
			<spot x="258.1224" y="241.2517" z="209.8867" h="49"/>
			<spot x="264.1305" y="210.4966" z="205.7615" h="49"/>
			<spot x="275.1180" y="299.2916" z="205.8489" h="98"/>
			<spot x="285.0000" y="229.0000" z="209.3622" h="15"/>
			<spot x="288.0000" y="229.0000" z="209.3701" h="38"/>
			<spot x="296.0000" y="276.0000" z="206.3569" h="21"/>
			<spot x="299.0000" y="276.0000" z="206.4478" h="45"/>
			<spot x="302.0000" y="259.0000" z="205.2299" h="24"/>
		</spawn>
		<!-- Legionary -->
		<spawn npc_id="205001">
			<spot x="63.5000" y="183.7500" z="228.7197" h="86"/>
		</spawn>
		<!-- Legionary -->
		<spawn npc_id="205019">
			<spot x="61.7500" y="176.3750" z="228.9820" h="58"/>
			<spot x="67.5000" y="185.7500" z="228.4363" h="81"/>
		</spawn>
		<!-- Legionary -->
		<spawn npc_id="205018">
			<spot x="59.5000" y="181.7500" z="228.7547" h="80"/>
			<spot x="65.7500" y="179.3750" z="228.8462" h="56"/>
		</spawn>
		<!-- Legionary -->
		<spawn npc_id="205002">
			<spot x="69.7500" y="181.3750" z="228.4128" h="70"/>
		</spawn>
		<!-- Legionary -->
		<spawn npc_id="205012">
			<spot x="117.0778" y="216.1102" z="222.1000" h="97" state="35"/>
			<spot x="127.0425" y="202.9621" z="223.0000" h="18" state="35"/>
		</spawn>
		<!-- Legionary -->
		<spawn npc_id="205007">
			<spot x="110.0000" y="206.0000" z="213.0000" h="33" state="35"/>
			<spot x="126.0000" y="205.0000" z="225.0000" h="90" state="35"/>
			<spot x="162.0000" y="219.0000" z="220.0000" h="15" state="35"/>
			<spot x="164.0000" y="188.0000" z="203.0000" h="11" state="35"/>
			<spot x="185.0000" y="238.0000" z="223.0000" h="90" state="35"/>
			<spot x="190.0000" y="202.0000" z="219.0000" h="45" state="35"/>
		</spawn>
		<!-- Legionary -->
		<spawn npc_id="205008">
			<spot x="141.0000" y="234.0000" z="199.0000" h="100" state="35"/>
			<spot x="150.0000" y="222.0000" z="213.0000" h="11" state="35"/>
			<spot x="162.0000" y="240.0000" z="220.0000" h="111" state="35"/>
			<spot x="173.0000" y="267.0000" z="212.0000" h="8" state="35"/>
		</spawn>
		<!-- Legionary -->
		<spawn npc_id="205014">
			<spot x="161.3263" y="224.7709" z="218.5592" h="79" state="35"/>
			<spot x="175.1441" y="234.6884" z="226.1000" h="79" state="35"/>
		</spawn>
		<!-- Legionary -->
		<spawn npc_id="205015">
			<spot x="204.0000" y="255.9870" z="216.1000" h="91" state="35"/>
		</spawn>
		<!-- Legionary -->
		<spawn npc_id="205016">
			<spot x="254.0000" y="303.0000" z="205.5542" h="90"/>
			<spot x="287.0000" y="231.0000" z="209.6033" h="75"/>
		</spawn>
		<!-- Legionary -->
		<spawn npc_id="205017">
			<spot x="297.0000" y="278.0000" z="206.6896" h="105"/>
		</spawn>
	</spawn_map>
</spawns>
